"Status","Start Time","Stop Time","Duration in ms","Parent Suite","Suite","Sub Suite","Test Class","Test Method","Name","Description"
"passed","Mon Oct 07 02:55:36 GMT 2024","Mon Oct 07 02:55:37 GMT 2024","977","","Form Authentication","","","","validate, login successful text",""
"passed","Mon Oct 07 02:55:30 GMT 2024","Mon Oct 07 02:55:30 GMT 2024","269","","A/B Testing","","","","validate, hearder text and ab testing header text",""
"passed","Mon Oct 07 02:55:33 GMT 2024","Mon Oct 07 02:55:33 GMT 2024","482","","Add Remove Elements","","","","validate, delete button is not visible & not exist",""
"passed","Mon Oct 07 02:55:32 GMT 2024","Mon Oct 07 02:55:33 GMT 2024","419","","Add Remove Elements","","","","validate, delete button is visible & exist",""
"passed","Mon Oct 07 02:55:32 GMT 2024","Mon Oct 07 02:55:32 GMT 2024","770","","Add Remove Elements","","","","validate, add element button is visible",""
