"Status","Start Time","Stop Time","Duration in ms","Parent Suite","Suite","Sub Suite","Test Class","Test Method","Name","Description"
"passed","Sun Apr 14 03:17:28 GMT 2024","Sun Apr 14 03:17:28 GMT 2024","353","","Add Remove Elements","","","","validate, delete button is not visible & not exist",""
"passed","Sun Apr 14 03:17:26 GMT 2024","Sun Apr 14 03:17:26 GMT 2024","229","","A/B Testing","","","","validate, hearder text and ab testing header text",""
"passed","Sun Apr 14 03:17:28 GMT 2024","Sun Apr 14 03:17:28 GMT 2024","278","","Add Remove Elements","","","","validate, delete button is visible & exist",""
"passed","Sun Apr 14 03:17:27 GMT 2024","Sun Apr 14 03:17:28 GMT 2024","393","","Add Remove Elements","","","","validate, add element button is visible",""
"passed","Sun Apr 14 03:17:30 GMT 2024","Sun Apr 14 03:17:31 GMT 2024","842","","Form Authentication","","","","validate, login successful text",""
