"Status","Start Time","Stop Time","Duration in ms","Parent Suite","Suite","Sub Suite","Test Class","Test Method","Name","Description"
"passed","Mon Apr 29 02:27:30 GMT 2024","Mon Apr 29 02:27:31 GMT 2024","847","","Form Authentication","","","","validate, login successful text",""
"passed","Mon Apr 29 02:27:28 GMT 2024","Mon Apr 29 02:27:28 GMT 2024","356","","Add Remove Elements","","","","validate, delete button is not visible & not exist",""
"passed","Mon Apr 29 02:27:27 GMT 2024","Mon Apr 29 02:27:28 GMT 2024","400","","Add Remove Elements","","","","validate, add element button is visible",""
"passed","Mon Apr 29 02:27:26 GMT 2024","Mon Apr 29 02:27:26 GMT 2024","234","","A/B Testing","","","","validate, hearder text and ab testing header text",""
"passed","Mon Apr 29 02:27:28 GMT 2024","Mon Apr 29 02:27:28 GMT 2024","279","","Add Remove Elements","","","","validate, delete button is visible & exist",""
