"Status","Start Time","Stop Time","Duration in ms","Parent Suite","Suite","Sub Suite","Test Class","Test Method","Name","Description"
"passed","Wed Jul 31 02:17:50 GMT 2024","Wed Jul 31 02:17:50 GMT 2024","264","","A/B Testing","","","","validate, hearder text and ab testing header text",""
"passed","Wed Jul 31 02:17:52 GMT 2024","Wed Jul 31 02:17:52 GMT 2024","307","","Add Remove Elements","","","","validate, delete button is visible & exist",""
"passed","Wed Jul 31 02:17:51 GMT 2024","Wed Jul 31 02:17:52 GMT 2024","485","","Add Remove Elements","","","","validate, add element button is visible",""
"passed","Wed Jul 31 02:17:52 GMT 2024","Wed Jul 31 02:17:53 GMT 2024","385","","Add Remove Elements","","","","validate, delete button is not visible & not exist",""
"passed","Wed Jul 31 02:17:55 GMT 2024","Wed Jul 31 02:17:55 GMT 2024","901","","Form Authentication","","","","validate, login successful text",""
