"DESCRIPTION","DURATION IN MS","NAME","PARENT SUITE","START TIME","STATUS","STOP TIME","SUB SUITE","SUITE","TEST CLASS","TEST METHOD"
"","360","validate, delete button is not visible & not exist","","Wed Jan 22 02:49:55 GMT 2025","passed","Wed Jan 22 02:49:56 GMT 2025","","Add Remove Elements","",""
"","275","validate, delete button is visible & exist","","Wed Jan 22 02:49:55 GMT 2025","passed","Wed Jan 22 02:49:55 GMT 2025","","Add Remove Elements","",""
"","386","validate, add element button is visible","","Wed Jan 22 02:49:55 GMT 2025","passed","Wed Jan 22 02:49:55 GMT 2025","","Add Remove Elements","",""
"","237","validate, hearder text and ab testing header text","","Wed Jan 22 02:49:53 GMT 2025","passed","Wed Jan 22 02:49:53 GMT 2025","","A/B Testing","",""
"","845","validate, login successful text","","Wed Jan 22 02:49:57 GMT 2025","passed","Wed Jan 22 02:49:58 GMT 2025","","Form Authentication","",""
