"DESCRIPTION","DURATION IN MS","NAME","PARENT SUITE","START TIME","STATUS","STOP TIME","SUB SUITE","SUITE","TEST CLASS","TEST METHOD"
"","848","validate, add element button is visible","","Tue Jan 14 02:43:24 GMT 2025","passed","Tue Jan 14 02:43:25 GMT 2025","","Add Remove Elements","",""
"","279","validate, hearder text and ab testing header text","","Tue Jan 14 02:43:22 GMT 2025","passed","Tue Jan 14 02:43:23 GMT 2025","","A/B Testing","",""
"","434","validate, delete button is visible & exist","","Tue Jan 14 02:43:25 GMT 2025","passed","Tue Jan 14 02:43:25 GMT 2025","","Add Remove Elements","",""
"","500","validate, delete button is not visible & not exist","","Tue Jan 14 02:43:25 GMT 2025","passed","Tue Jan 14 02:43:26 GMT 2025","","Add Remove Elements","",""
"","963","validate, login successful text","","Tue Jan 14 02:43:28 GMT 2025","passed","Tue Jan 14 02:43:29 GMT 2025","","Form Authentication","",""
