"DESCRIPTION","DURATION IN MS","NAME","PARENT SUITE","START TIME","STATUS","STOP TIME","SUB SUITE","SUITE","TEST CLASS","TEST METHOD"
"","852","validate, login successful text","","Sun Jan 05 02:56:26 GMT 2025","passed","Sun Jan 05 02:56:26 GMT 2025","","Form Authentication","",""
"","252","validate, hearder text and ab testing header text","","Sun Jan 05 02:56:21 GMT 2025","passed","Sun Jan 05 02:56:21 GMT 2025","","A/B Testing","",""
"","384","validate, delete button is not visible & not exist","","Sun Jan 05 02:56:23 GMT 2025","passed","Sun Jan 05 02:56:24 GMT 2025","","Add Remove Elements","",""
"","317","validate, delete button is visible & exist","","Sun Jan 05 02:56:23 GMT 2025","passed","Sun Jan 05 02:56:23 GMT 2025","","Add Remove Elements","",""
"","450","validate, add element button is visible","","Sun Jan 05 02:56:23 GMT 2025","passed","Sun Jan 05 02:56:23 GMT 2025","","Add Remove Elements","",""
