"Status","Start Time","Stop Time","Duration in ms","Parent Suite","Suite","Sub Suite","Test Class","Test Method","Name","Description"
"passed","Wed Jun 05 02:33:13 GMT 2024","Wed Jun 05 02:33:14 GMT 2024","951","","Form Authentication","","","","validate, login successful text",""
"passed","Wed Jun 05 02:33:10 GMT 2024","Wed Jun 05 02:33:11 GMT 2024","480","","Add Remove Elements","","","","validate, add element button is visible",""
"passed","Wed Jun 05 02:33:09 GMT 2024","Wed Jun 05 02:33:09 GMT 2024","222","","A/B Testing","","","","validate, hearder text and ab testing header text",""
"passed","Wed Jun 05 02:33:11 GMT 2024","Wed Jun 05 02:33:11 GMT 2024","400","","Add Remove Elements","","","","validate, delete button is not visible & not exist",""
"passed","Wed Jun 05 02:33:11 GMT 2024","Wed Jun 05 02:33:11 GMT 2024","332","","Add Remove Elements","","","","validate, delete button is visible & exist",""
