"Status","Start Time","Stop Time","Duration in ms","Parent Suite","Suite","Sub Suite","Test Class","Test Method","Name","Description"
"passed","Tue Oct 15 02:53:38 GMT 2024","Tue Oct 15 02:53:38 GMT 2024","267","","A/B Testing","","","","validate, hearder text and ab testing header text",""
"passed","Tue Oct 15 02:53:43 GMT 2024","Tue Oct 15 02:53:44 GMT 2024","969","","Form Authentication","","","","validate, login successful text",""
"passed","Tue Oct 15 02:53:40 GMT 2024","Tue Oct 15 02:53:40 GMT 2024","431","","Add Remove Elements","","","","validate, delete button is visible & exist",""
"passed","Tue Oct 15 02:53:40 GMT 2024","Tue Oct 15 02:53:41 GMT 2024","496","","Add Remove Elements","","","","validate, delete button is not visible & not exist",""
"passed","Tue Oct 15 02:53:39 GMT 2024","Tue Oct 15 02:53:40 GMT 2024","844","","Add Remove Elements","","","","validate, add element button is visible",""
